{
  "batch_id": "02-creation-progression",
  "page_start": 19,
  "page_end": 43,
  "notes": "Pages 19–43. Filigrane et en-têtes/pieds retirés ; césures recollées. La page 21 est décorative (filet de numéros, pas de corps extractible). Incohérences du livre conservées telles quelles : Lhagva PV 12 dans les exemples de création (p. 30, p. 39) contre PV 15 sur la fiche (p. 37) ; Ionas voie du mage rang 1 : « Lumière des étoiles » (p. 30) contre « Lumière intérieure » (p. 37). Les profils, peuples et voies ne sont listés ici qu’au niveau de la création ; fiches détaillées dans les lots suivants. Pas de table d’attaque chiffrée dans le livre : seulement la règle +1/niveau jusqu’au niveau 10.",
  "sections": [
    {
      "title": "Partie I — Le personnage",
      "kind": "chapter",
      "page_start": 19,
      "page_end": 19,
      "summary": "Page de titre de la Partie I, consacrée au personnage.",
      "body": "# Partie I — Le personnage\n"
    },
    {
      "title": "Chapitre 1 — Création du personnage",
      "kind": "chapter",
      "page_start": 20,
      "page_end": 37,
      "summary": "Création d’un personnage joueur : prétirés ou quinze étapes, de l’idée du rôle à la touche finale.",
      "body": "# Chapitre 1 — Création du personnage\n\nPour pouvoir se lancer dans une partie de Chroniques Oubliées Fantasy, il est indispensable que chaque joueur dispose d’un personnage joueur (PJ). S’il n’a encore jamais joué, il y a deux possibilités : utiliser un personnage déjà prêt à jouer (ou « prétiré », dans le jargon rôliste), ou bien créer un personnage en utilisant les règles fournies dans ce chapitre.\n\nLes explications de ce chapitre sont illustrées par les étapes de création de **Lhagva** (barbare) et **Ionas** (ensorceleur).\n"
    },
    {
      "title": "En quelques mots",
      "kind": "section",
      "page_start": 20,
      "page_end": 22,
      "summary": "Prétirés ou création maison ; collaboration joueur/MJ ; feuille de personnage.",
      "body": "# En quelques mots\n\nS’il n’a encore jamais joué, le joueur a deux possibilités : utiliser un personnage déjà prêt à jouer (« prétiré »), ou créer un personnage avec les règles de ce chapitre.\n\n## Personnages prétirés\n\nSi le temps est limité ou si cela semble plus confortable pour une première expérience, des PJ prétirés sont fournis à la fin de l’ouvrage. On peut les recopier sur la feuille de personnage vierge (fin d’ouvrage) ou télécharger gratuitement leurs feuilles sur www.black-book-editions.fr. Une fois le personnage choisi, il reste à lui apporter la touche finale au point 15 de ce chapitre (langues connues, idéal héroïque ou travers).\n\n## Création d’un PJ\n\nSi le joueur a un peu de temps ou l’envie (même en étant débutant), créer soi-même un PJ permet de définir le héros correspondant le plus à ses aspirations. La création d’un PJ se fait idéalement en collaboration entre le joueur concerné et le meneur de jeu (MJ).\n\nUn personnage est défini par un certain nombre d’éléments à inscrire sur une feuille de personnage (feuille vierge en fin d’ouvrage ou sur www.black-book-editions.fr).\n"
    },
    {
      "title": "La création de personnage (résumé)",
      "kind": "sidebar",
      "page_start": 22,
      "page_end": 22,
      "summary": "Liste des quinze étapes de création avec renvois de pages.",
      "body": "# La création de personnage (résumé)\n\nAprès avoir réfléchi au personnage que vous voulez jouer, voici les différentes étapes à suivre pour lui donner corps.\n\n1. Rôle (page 20)\n2. Profil (page 22)\n3. Peuple (page 25)\n4. Caractéristiques (page 26)\n5. Voies et capacités (page 29)\n6. Points de vigueur (page 30)\n7. Dé de récupération (page 30)\n8. Points de chance (page 30)\n9. Points de mana (page 31)\n10. Initiative (page 31)\n11. Équipement (page 31)\n12. Défense (page 31)\n13. Valeurs d’attaque (page 32)\n14. Dommages (page 32)\n15. Touche finale (page 33)\n"
    },
    {
      "title": "1 · Rôle",
      "kind": "section",
      "page_start": 20,
      "page_end": 22,
      "summary": "Imaginer le personnage, son rôle dans l’équipe et un groupe complémentaire.",
      "body": "# 1 · Rôle\n\nLa première chose à déterminer est le rôle que vous voulez jouer. Avant de traiter votre personnage du point de vue des règles, il vous faut commencer par l’imaginer, par le rêver. Essayez de vous faire une image mentale de votre futur alter ego.\n\nVous ressemble-t-il ou est-il tout votre contraire ? Est-ce une guerrière aux muscles d’acier ou un magicien chétif doté de grands pouvoirs ? Quel rôle avez-vous envie de tenir au sein de votre équipe de héros en herbe ? Un combattant sans peur ? Une lanceuse de sorts ? Un mystique habité par la foi ? Une aventurière polyvalente ? Un voleur pernicieux ? Souhaitez-vous plutôt jouer une naine bourrue ou un gracieux elfe ? À moins qu’un humain ne vous semble moins caricatural à interpréter…\n\nSi vous manquez d’idées, il est souvent plus aisé de partir d’une illustration. Elle peut être choisie dans cet ouvrage, mais Internet fourmille de propositions grandioses et inspirantes. Ce peut être un très bon point de départ. Et si vous n’avez pas plus d’idées que ça au départ, ce n’est pas grave du tout : vous pouvez très bien commencer avec un concept vague (un guerrier, une magicienne…), le reste viendra au fur et à mesure de la création du personnage, voire plus tard, en cours d’aventure.\n\nEnfin, il est toujours bon de tenir compte des autres joueurs. L’idéal est que les joueurs soient réunis pour créer leurs personnages de façon à créer un groupe équilibré. Ils auront moins de difficultés à surmonter les défis qui leur seront proposés si les personnages sont complémentaires plutôt que concurrents, et chacun pourra briller à son tour. La diversité est une force, qu’on se le dise !\n\nTout au long de cet ouvrage, les exemples s’appuient sur la table suivante :\n\n- Anaïs joue **Lhagva**, fille de Nuala, puissante combattante qui ne connaît pas la peur.\n- Salim joue **Ionas Melenwë**, lanceur de sorts.\n- Léo joue un personnage féminin proche de la nature, **Skodja**.\n- Ilona interprète **Wilibert Sûreté**, personnage discret, un tantinet filou.\n- La meneuse de jeu se prénomme Valentine.\n\nDans ce chapitre, les règles de création sont illustrées par Lhagva et Ionas.\n"
    },
    {
      "title": "2 · Profil",
      "kind": "section",
      "page_start": 22,
      "page_end": 25,
      "summary": "Quatre familles (aventuriers, combattants, mages, mystiques) et quatorze profils ; niveau 1 à la création.",